{
  "id": "motion.ease_in_out_guidance.v1",
  "version": 1,
  "name": "Ease-in and ease-out guidance",
  "domain": "motion",
  "status": "reference_only",
  "summary": "Use acceleration and deceleration that support the intended motion without implying an unverified native control.",
  "creativeJobs": ["shape motion rhythm"],
  "intentTags": ["motion", "restrained"],
  "mediaPrerequisites": ["an admitted motion construction"],
  "refusalConditions": ["the requested easing has no admitted emitter mapping"],
  "prerequisiteRules": [{"kind":"required_role","role":"primary"}], "refusalRules": [],
  "lockedStructureEffect": "none",
  "construction": {"preferredBackends": ["none"], "requiredCapabilities": [], "previewFidelity": "none"},
  "parameters": [],
  "qualityChecks": ["motion starts and lands without a visible mechanical snap"],
  "failureModes": ["presenting conceptual easing as a live Final Cut control"],
  "safety": ["preserve the locked timing while changing only allowed treatment construction"],
  "riskGates": [{"category":"editorial_integrity","level":"low","decision":"allowed_automatically","basis":"Reference-only easing guidance has no emitter mapping."}], "safetyGates": [{"category":"editorial_integrity","level":"low","decision":"allowed_automatically","basis":"Reference-only guidance cannot change locked timing."}],
  "editability": ["none"],
  "expectedCost": {"latency": "instant", "monetary": "free", "privacy": "local_only"},
  "provenance": [{"sourceId": "docs/editorial-intelligence/EDITORIAL_PLAYBOOK.md", "claim": "motion rhythm should support the moment rather than announce the mechanism", "confidence": "direct_evidence"}],
  "validation": {"implemented": false, "visuallyVerified": false, "notes": "Conceptual guidance only; no additional easing control is claimed."}
}
