{
  "id": "typography.caption_guidance.v1",
  "version": 1,
  "name": "Caption guidance",
  "domain": "typography",
  "status": "reference_only",
  "summary": "Guide caption wording, placement, and protected-region avoidance without claiming a live caption emitter.",
  "creativeJobs": ["make spoken content accessible"],
  "intentTags": ["captions", "accessibility", "clarity"],
  "mediaPrerequisites": ["spoken content and caption text"],
  "refusalConditions": ["no admitted caption construction is available"],
  "prerequisiteRules": [{"kind":"audio_presence","hasAudio":true}], "refusalRules": [],
  "lockedStructureEffect": "none",
  "construction": {"preferredBackends": ["none"], "requiredCapabilities": ["typography"], "previewFidelity": "none"},
  "parameters": [],
  "qualityChecks": ["caption does not obscure a protected region"],
  "failureModes": ["caption timing changes narration structure"],
  "safety": ["retain director-approved narration and timing"],
  "riskGates": [{"category":"accessibility","level":"moderate","decision":"requires_user_approval","basis":"No caption construction is admitted."}], "safetyGates": [{"category":"accessibility","level":"moderate","decision":"requires_user_approval","basis":"Narration timing requires editorial approval."}],
  "editability": ["none"],
  "expectedCost": {"latency": "instant", "monetary": "free", "privacy": "local_only"},
  "provenance": [{"sourceId": "W3C-A11Y-002", "claim": "captions provide an equivalent for audio content", "confidence": "official_documentation"}],
  "validation": {"implemented": false, "visuallyVerified": false, "notes": "Guidance only; no caption placement or export construction is implemented."}
}
