{
  "id": "safety.flash_pse_blocker.v1",
  "version": 1,
  "name": "Flash and photosensitivity blocker",
  "domain": "safety",
  "status": "reference_only",
  "summary": "Block treatments whose temporal flash pattern has not passed a photosensitivity review.",
  "creativeJobs": ["keep flicker treatments safe"],
  "intentTags": ["safety", "flicker"],
  "mediaPrerequisites": ["a time-varying treatment"],
  "refusalConditions": ["flash frequency or contrast has not been measured"],
  "prerequisiteRules": [{"kind":"role_count","count":1}], "refusalRules": [],
  "lockedStructureEffect": "none",
  "construction": {"preferredBackends": ["none"], "requiredCapabilities": ["flash_analysis"], "previewFidelity": "none"},
  "parameters": [],
  "qualityChecks": ["temporal flashes stay within the stated safety rule"],
  "failureModes": ["a short loop hides a repeated flash pattern"],
  "safety": ["refuse unmeasured flash treatments"],
  "riskGates": [{"category":"photosensitive_flash","level":"critical","decision":"refused","basis":"No automatic PSE measurement exists for arbitrary time-varying treatments."}], "safetyGates": [{"category":"photosensitive_flash","level":"critical","decision":"refused","basis":"Unmeasured flash frequency or contrast must not be admitted."}],
  "editability": ["none"],
  "expectedCost": {"latency": "seconds", "monetary": "free", "privacy": "local_only"},
  "provenance": [{"sourceId": "W3C-SAFETY-001", "claim": "content should not flash more than three times per second", "confidence": "official_documentation"}],
  "validation": {"implemented": false, "visuallyVerified": false, "notes": "The policy is present; automatic PSE measurement is not implemented."}
}
