{
  "id": "analysis.mask_tracking_edge_quality.v1",
  "version": 1,
  "name": "Mask and tracking edge-quality review",
  "domain": "analysis",
  "status": "reference_only",
  "summary": "Inspect tracked or masked edges across motion before compositing a treatment around them.",
  "creativeJobs": ["prevent edge chatter and halos"],
  "intentTags": ["compositing", "quality"],
  "mediaPrerequisites": ["a clip with a tracked or masked subject"],
  "refusalConditions": ["no admitted mask or tracking analysis is available"],
  "prerequisiteRules": [{"kind":"required_role","role":"primary"}], "refusalRules": [],
  "lockedStructureEffect": "none",
  "construction": {"preferredBackends": ["none"], "requiredCapabilities": ["mask_tracking_analysis"], "previewFidelity": "none"},
  "parameters": [],
  "qualityChecks": ["edge holds against contrasting backgrounds"],
  "failureModes": ["a still-frame mask hides temporal edge chatter"],
  "safety": ["do not obscure protected subjects"],
  "riskGates": [{"category":"editorial_integrity","level":"moderate","decision":"requires_user_approval","basis":"No mask/tracking emitter is admitted."}], "safetyGates": [{"category":"content_safety","level":"moderate","decision":"requires_user_approval","basis":"Protected-subject impact is not automatically measured."}],
  "editability": ["none"],
  "expectedCost": {"latency": "seconds", "monetary": "free", "privacy": "local_only"},
  "provenance": [{"sourceId": "docs/editorial-intelligence/QUALITY_RUBRIC.md", "claim": "representative moving-media review is required before calling a compositing result good", "confidence": "direct_evidence"}],
  "validation": {"implemented": false, "visuallyVerified": false, "notes": "No mask or tracking analysis is implemented in FrameSmith."}
}
